{
  "schema": "issue/1",
  "date": "2026-09-20",
  "weekday": "周日",
  "lang": "zh-CN",
  "issue_url": "https://daily.juya.uk/issues/2026-09-20/",
  "video_links": {
    "bilibili": "https://www.bilibili.com/video/BV1NqeY6dEPP",
    "youtube": "https://www.youtube.com/watch?v=x61i-WudtDo"
  },
  "sections": [
    {
      "slug": "dev-eco",
      "name": "开发生态"
    },
    {
      "slug": "model-release",
      "name": "模型发布"
    },
    {
      "slug": "tech-insight",
      "name": "技术与洞察"
    },
    {
      "slug": "industry",
      "name": "行业动态"
    },
    {
      "slug": "rumor-mill",
      "name": "前瞻与传闻"
    }
  ],
  "intro": {
    "voice": [
      "各位观众早上好，今天是九月二十日周日。",
      "欢迎收看AI早报，屏幕上是今天的主要内容，接下来请看详细报道。"
    ]
  },
  "outro": {
    "voice": [
      "今天的资讯播送完了，明天见！"
    ]
  },
  "items": [
    {
      "id": "deepseek",
      "section": "dev-eco",
      "nav": "DeepSeek",
      "headline": "DeepSeek API明确节假日及调休周末全天按空闲时段计费",
      "tldr": "**DeepSeek** `API`平台近日发布公告横幅明确，调休上班的周末和中国法定节假日全天按空闲时段计费。该规则面向使用**DeepSeek**官方`API`的用户。",
      "body": [
        "**DeepSeek** `API`平台近日发布公告横幅明确，调休上班的周末及中国法定节假日全天均按空闲时段计费。即使周末因调休成为工作日，也适用这一计费时段规则。该规则面向使用**DeepSeek**官方`API`的用户。"
      ],
      "sources": [
        {
          "url": "https://platform.deepseek.com/",
          "kind": "official",
          "primary": true
        }
      ],
      "confidence": "confirmed",
      "voice": [
        "DeepSeek API平台近日发布公告横幅明确，调休上班的周末和中国法定节假日全天按空闲时段计费。",
        "该规则面向使用DeepSeek官方API的用户。"
      ],
      "cards": [
        {
          "label": "计费新规",
          "body": "调休上班的周末及中国法定节假日，全天均按空闲时段费率计费",
          "icon": ""
        },
        {
          "label": "适用范围",
          "body": "面向使用 DeepSeek 官方 API 的用户，平台公告横幅已明确该规则",
          "icon": ""
        }
      ],
      "media": [
        {
          "kind": "shot",
          "src": "shots/deepseek.png",
          "origin": "https://platform.deepseek.com/"
        },
        {
          "kind": "image",
          "src": "https://assets.juya.uk/imagehub/aidaily/1d304b0d-ec1e-44ca-87ec-bacc02b23c6e/9729dbc6-4c6a-4c47-9d27-18db8ab6e648/m001_23e08492.png",
          "origin": "https://platform.deepseek.com/"
        }
      ],
      "video": {
        "shot_sentences": [
          1,
          2
        ]
      }
    },
    {
      "id": "tibo",
      "section": "dev-eco",
      "nav": "Tibo",
      "headline": "Tibo疑似暗示Codex banked reset",
      "tldr": "有用户因 **OpenAI** 本周没有推出预期更新，向 **Codex** 负责人 **Tibo** 索要 `banked reset`，**Tibo** 回复：“OK fine. But it’s also still coming in **Tuesday**”。 有人认为“OK fine”是在同意提供 `banked reset`；也有观点认为他并未确认 `reset`，真正明确的只是此前预告的内容仍会在**周二**到来。",
      "body": [
        "有用户发帖称 **OpenAI** 本周没有推出此前预期的更新，因此向 `Codex` 负责人 **Tibo** 喊话：“you owe us a `banked reset` sorry i don’t make the rules”。**Tibo** 随后回复：“OK fine. But it’s also still coming in **Tuesday**”。",
        "这段回复随后出现两种不同解读。有用户认为“OK fine”是在同意提供 `banked reset`，并把这视为 **Tibo** 对 `reset` 请求的回应；也有观点认为这句话并没有确认会提供 `reset`，“OK fine”不足以构成明确承诺，真正明确的信息只是此前预告的内容仍会在周二到来。**Tibo** 的原话本身没有直接写出“`banked reset`”，因此是否会有 `reset` 仍取决于对这段回复的理解。"
      ],
      "sources": [
        {
          "url": "https://x.com/thsottiaux/status/2101352781219258527",
          "kind": "social",
          "primary": true
        }
      ],
      "confidence": "reported",
      "voice": [
        "有用户因OpenAI本周没有推出预期更新，向Codex负责人Tibo索要banked reset，Tibo回复“OK fine, but it's also still coming Tuesday”。",
        "有人认为“OK fine”是在同意提供banked reset；",
        "也有观点认为他并未确认reset，真正明确的只是此前预告的内容仍会在周二到来。"
      ],
      "cards": [
        {
          "label": "起因",
          "body": "OpenAI 本周没有推出预期更新，用户向 Codex 负责人 Tibo 索要 banked reset",
          "icon": ""
        },
        {
          "label": "语义争议",
          "body": "Tibo 回复“OK fine, but it's also still coming Tuesday”，是否承诺 reset 出现两种解读",
          "icon": ""
        }
      ],
      "media": [
        {
          "kind": "shot",
          "src": "shots/tibo.png",
          "origin": "https://x.com/thsottiaux/status/2101352781219258527"
        },
        {
          "kind": "image",
          "src": "https://assets.juya.uk/imagehub/aidaily/1d304b0d-ec1e-44ca-87ec-bacc02b23c6e/9345883d-b95d-4ded-a3f0-489ed5bc1ead/m001_e29c2e5a.png",
          "origin": "https://x.com/thsottiaux/status/2101352781219258527"
        }
      ],
      "video": {
        "shot_sentences": [
          1
        ]
      }
    },
    {
      "id": "step5",
      "section": "model-release",
      "nav": "Step 5 Preview",
      "headline": "Step 5 Preview现身Artificial Analysis网站",
      "tldr": "阶跃星辰的 Step 5 Preview模型现身Artificial Analysis榜单，另有部分Step Plan用户称已可调用。第三方评测显示，该模型智能指数为44，支持1M上下文和视觉输入。更多信息有待官方正式发布。",
      "body": [
        "**Artificial Analysis**收录**阶跃星辰**的`Step 5 Preview`，并完成独立评测，部分`Step Plan`用户也称已能看到并调用该模型。",
        "页面显示，其智能指数为**44**，支持**1M** `上下文`和`视觉输入`。百万输入和输出`token`价格分别为**1美元**和**2.7美元**。",
        "`Step 5 Preview`目前在该页面上被列为`闭源模型`，但**阶跃星辰**尚未正式发布，实际开放范围及发布时间仍不明确。"
      ],
      "sources": [
        {
          "url": "https://artificialanalysis.ai/models/step-5",
          "kind": "official",
          "primary": true
        }
      ],
      "confidence": "reported",
      "voice": [
        "阶跃星辰的Step 5 Preview模型现身Artificial Analysis榜单，另有部分Step Plan用户称已可调用。",
        "第三方评测显示，该模型智能指数为44，支持1M上下文和视觉输入，更多信息有待官方正式发布。"
      ],
      "cards": [
        {
          "label": "榜单收录",
          "body": "阶跃星辰 Step 5 Preview 现身 Artificial Analysis 榜单并完成独立评测",
          "icon": ""
        },
        {
          "label": "评测数据",
          "body": "智能指数 44，支持 1M 上下文和视觉输入，百万输入/输出价格 1 / 2.7 美元",
          "icon": ""
        },
        {
          "label": "可用情况",
          "body": "部分 Step Plan 用户称已可调用，页面列为闭源模型，官方尚未正式发布",
          "icon": ""
        }
      ],
      "media": [
        {
          "kind": "shot",
          "src": "shots/step5.png",
          "origin": "https://artificialanalysis.ai/models/step-5"
        },
        {
          "kind": "image",
          "src": "https://assets.juya.uk/imagehub/aidaily/1d304b0d-ec1e-44ca-87ec-bacc02b23c6e/c4c35042-5662-4d92-a9a3-92ec4cc8f8a8/m001_25847c4b.png",
          "origin": "https://artificialanalysis.ai/models/step-5"
        },
        {
          "kind": "image",
          "src": "https://assets.juya.uk/imagehub/aidaily/1d304b0d-ec1e-44ca-87ec-bacc02b23c6e/c4c35042-5662-4d92-a9a3-92ec4cc8f8a8/m002_0f25a59a.png",
          "origin": "https://artificialanalysis.ai/models/step-5"
        }
      ],
      "facts": [
        "智能指数44",
        "1M上下文",
        "百万输入/输出价格1/2.7美元"
      ],
      "video": {
        "shot_sentences": [
          1
        ]
      }
    },
    {
      "id": "qwen",
      "section": "model-release",
      "nav": "Qwen3.8-LiveTranslate",
      "headline": "千问发布Qwen3.8-LiveTranslate",
      "tldr": "**千问**发布同传模型`Qwen3.8-LiveTranslate`，支持**60种语言**实时翻译。模型采用`Interleave`架构和`Thinker-Talker`双模块设计，新增`实时说话人分离`、`原文译文同帧输出`与`长上下文消歧`能力，在线体验与`API`均已上线。",
      "body": [
        "**千问**目前已正式发布同声传译大模型`Qwen3.8-LiveTranslate`，面向真实对话提供**60种语言**的实时翻译。",
        "模型采用`Interleave`架构，将音频与文本组织为交织单流，缓存复用已听音频和已输出译文，字均延迟由上一代的**2.8秒**降至**2.3秒**。",
        "模型新增实时说话人分离、原文译文同帧输出和长上下文消歧**三项能力**。",
        "根据**千问**公布的评测结果，模型在多说话人长音频和多语言实时同传测试中均优于上一代及当前主流系统。",
        "目前，用户可在线体验，模型`API`也已上线**千问**AI平台。"
      ],
      "sources": [
        {
          "url": "https://mp.weixin.qq.com/s/Rc3CKdHAtA_NdVRN2RLuAg",
          "kind": "media",
          "primary": true
        }
      ],
      "confidence": "confirmed",
      "voice": [
        "千问发布同传模型Qwen3.8-LiveTranslate，支持60种语言实时翻译。",
        "模型采用Interleave架构和Thinker-Talker双模块设计，新增实时说话人分离、原文译文同帧输出与长上下文消歧能力，在线体验与API均已上线。"
      ],
      "cards": [
        {
          "label": "60种语言",
          "body": "面向真实对话的实时同传，支持 60 种语言",
          "icon": ""
        },
        {
          "label": "架构",
          "body": "Interleave 架构 + Thinker-Talker 双模块，字均延迟 2.8s → 2.3s",
          "icon": ""
        },
        {
          "label": "新能力",
          "body": "实时说话人分离、原文译文同帧输出、长上下文消歧",
          "icon": ""
        },
        {
          "label": "可用性",
          "body": "在线体验与 API 均已上线千问 AI 平台",
          "icon": ""
        }
      ],
      "media": [
        {
          "kind": "image",
          "src": "https://assets.juya.uk/imagehub/aidaily/1d304b0d-ec1e-44ca-87ec-bacc02b23c6e/713f302d-96af-454e-9bf0-137fccd523c2/m001_5cd152ab.png",
          "origin": "https://mp.weixin.qq.com/s/Rc3CKdHAtA_NdVRN2RLuAg"
        },
        {
          "kind": "image",
          "src": "https://assets.juya.uk/imagehub/aidaily/1d304b0d-ec1e-44ca-87ec-bacc02b23c6e/713f302d-96af-454e-9bf0-137fccd523c2/m002_0167ddf4.png",
          "origin": "https://mp.weixin.qq.com/s/Rc3CKdHAtA_NdVRN2RLuAg"
        }
      ],
      "facts": [
        "60种语言",
        "字均延迟2.8s→2.3s"
      ]
    },
    {
      "id": "radar",
      "section": "model-release",
      "nav": "RADAR",
      "headline": "阿里巴巴达摩院开源腹部CT诊断模型RADAR，论文发表于Science",
      "tldr": "**阿里巴巴达摩院**开源了腹部`CT`诊断`视觉语言模型``RADAR`，论文发表于Science。该模型用**超40万例**CT和**1500万**图文对训练，覆盖**18个**解剖结构和**146项**影像发现，内外部诊断`AUC` **超0.87**。代码与权重已开放。",
      "body": [
        "**阿里巴巴达摩院**在 **GitHub** 开源了腹部 **CT** 诊断通用视觉语言模型 `RADAR`（`Rapid Abdominal Diagnosis with AI and Radiology`），相关研究论文发表于 **Science**。",
        "`RADAR` 在包含 **424,911** 例增强腹部 **CT** 检查、**1500 万**解剖级图文对的 `RAD-CT` 数据集上训练，直接从临床报告学习，无需人工标注。",
        "根据论文，模型覆盖 **18** 个解剖结构和 **146** 项影像发现，内部真实世界队列诊断 `AUC` 为 **0.913**，八家外部中心 `AUC` 为 **0.874** 至 **0.912**。",
        "论文还报告，在 **26** 名放射科医生参与的阅读研究中，`RADAR` 协作使用使诊断敏感度提升约 **10%**。",
        "预训练检查点已在 **HuggingFace** 的 `radar-generalist` 页面提供，代码同步存档于 `Zenodo`，仓库采用 `Apache 2.0` 许可证，并附带训练、推理与预处理文档及演示数据。"
      ],
      "sources": [
        {
          "url": "https://github.com/alibaba-damo-academy/damo-radar",
          "kind": "repo",
          "primary": true
        },
        {
          "url": "https://huggingface.co/radar-generalist/RADAR",
          "kind": "official"
        },
        {